,sms,spam/ham_spam
0,go until jurong point crazi avail onli in bugi n great world la e buffet cine there got amor wat,0
1,ok lar joke wif u oni,0
2,free entri in a wkli comp to win fa cup final tkt st may text fa to to receiv entri question std txt rate t c s appli over s,1
3,u dun say so earli hor u c alreadi then say,0
4,nah i don t think he goe to usf he live around here though,0
5,freemsg hey there darl it s been week s now and no word back i d like some fun you up for it still tb ok xxx std chg to send to rcv,1
6,even my brother is not like to speak with me they treat me like aid patent,0
7,as per your request mell mell oru minnaminungint nurungu vettam ha been set as your callertun for all caller press to copi your friend callertun,0
8,winner as a valu network custom you have been select to receivea prize reward to claim call claim code kl valid hour onli,1
9,had your mobil month or more u r entitl to updat to the latest colour mobil with camera for free call the mobil updat co free on,1
10,i m gonna be home soon and i don t want to talk about thi stuff anymor tonight k i ve cri enough today,0
11,six chanc to win cash from to pound txt csh and send to cost p day day tsandc appli repli hl info,1
12,urgent you have won a week free membership in our prize jackpot txt the word claim to no t c www dbuk net lccltd pobox ldnw a rw,1
13,i ve been search for the right word to thank you for thi breather i promis i wont take your help for grant and will fulfil my promis you have been wonder and a bless at all time,0
14,i have a date on sunday with will,0
15,xxxmobilemovieclub to use your credit click the wap link in the next txt messag or click here http wap xxxmobilemovieclub com n qjkgighjjgcbl,1
16,oh k i m watch here,0
17,eh u rememb how spell hi name ye i did he v naughti make until i v wet,0
18,fine if that s the way u feel that s the way it gota b,0
19,england v macedonia dont miss the goal team news txt ur nation team to eg england to tri wale scotland txt poboxox w wq,1
20,is that serious how you spell hi name,0
21,i m go to tri for month ha ha onli joke,0
22,so pay first lar then when is da stock comin,0
23,aft i finish my lunch then i go str down lor ard smth lor u finish ur lunch alreadi,0
24,ffffffffff alright no way i can meet up with you sooner,0
25,just forc myself to eat a slice i m realli not hungri tho thi suck mark is get worri he know i m sick when i turn down pizza lol,0
26,lol your alway so convinc,0
27,did you catch the bu are you fri an egg did you make a tea are you eat your mom s left over dinner do you feel my love,0
28,i m back amp we re pack the car now i ll let you know if there s room,0
29,ahhh work i vagu rememb that what doe it feel like lol,0
30,wait that s still not all that clear were you not sure about me be sarcast or that that s whi x doesn t want to live with us,0
31,yeah he got in at and wa v apologet n had fallen out and she wa actin like spoilt child and he got caught up in that till but we won t go there not do too badli cheer you,0
32,k tell me anyth about you,0
33,for fear of faint with the of all that housework you just did quick have a cuppa,0
34,thank for your subscript to rington uk your mobil will be charg month pleas confirm by repli ye or no if you repli no you will not be charg,1
35,yup ok i go home look at the time then i msg again xuhui go to learn on nd may too but her lesson is at am,0
36,oop i ll let you know when my roommat s done,0
37,i see the letter b on my car,0
38,anyth lor u decid,0
39,hello how s you and how did saturday go i wa just text to see if you d decid to do anyth tomo not that i m tri to invit myself or anyth,0
40,pl go ahead with watt i just want to be sure do have a great weekend abiola,0
41,did i forget to tell you i want you i need you i crave you but most of all i love you my sweet arabian steed mmmmmm yummi,0
42,rodger burn msg we tri to call you re your repli to our sm for a free nokia mobil free camcord pleas call now for deliveri tomorrow,1
43,who are you see,0
44,great i hope you like your man well endow i am lt gt inch,0
45,no call messag miss call,0
46,didn t you get hep b immunis in nigeria,0
47,fair enough anyth go on,0
48,yeah hope if tyler can t do it i could mayb ask around a bit,0
49,u don t know how stubborn i am i didn t even want to go to the hospit i kept tell mark i m not a weak sucker hospit are for weak sucker,0
50,what you think about me first time you saw me in class,0
51,a gram usual run like lt gt a half eighth is smarter though and get you almost a whole second gram for lt gt,0
52,k fyi x ha a ride earli tomorrow morn but he s crash at our place tonight,0
53,wow i never realiz that you were so embarass by your accomod i thought you like it sinc i wa do the best i could and you alway seem so happi about the cave i m sorri i didn t and don t have more to give i m sorri i offer i m sorri your room wa so embarass,0
54,sm ac sptv the new jersey devil and the detroit red wing play ice hockey correct or incorrect end repli end sptv,1
55,do you know what mallika sherawat did yesterday find out now lt url gt,0
56,congrat year special cinema pass for is your call now c suprman v matrix starwar etc all free bx ip we pm dont miss out,1
57,sorri i ll call later in meet,0
58,tell where you reach,0
59,ye gauti and sehwag out of odi seri,0
60,your gonna have to pick up a burger for yourself on your way home i can t even move pain is kill me,0
61,ha ha ha good joke girl are situat seeker,0
62,it a part of check iq,0
63,sorri my roommat took forev it ok if i come by now,0
64,ok lar i doubl check wif da hair dresser alreadi he said wun cut v short he said will cut until i look nice,0
65,as a valu custom i am pleas to advis you that follow recent review of your mob no you are award with a bonu prize call,1
66,today is song dedic day which song will u dedic for me send thi to all ur valuabl frnd but first rpli me,0
67,urgent ur award a complimentari trip to eurodisinc trav aco entri or to claim txt di to morefrmmob shracomorsglsuplt ls aj,1
68,did you hear about the new divorc barbi it come with all of ken s stuff,1
69,i plane to give on thi month end,0
70,wah lucki man then can save money hee,0
71,finish class where are you,0
72,hi babe im at home now wanna do someth xx,0
73,k k where are you how did you perform,0
74,u can call me now,0
75,i am wait machan call me onc you free,0
76,that cool i am a gentleman and will treat you with digniti and respect,0
77,i like you peopl veri much but am veri shi pa,0
78,doe not oper after lt gt or what,0
79,it not the same here still look for a job how much do ta s earn there,0
80,sorri i ll call later,0
81,k did you call me just now ah,0
82,ok i am on the way to home hi hi,0
83,you will be in the place of that man,0
84,yup next stop,0
85,i call you later don t have network if urgnt sm me,0
86,for real when u get on yo i onli need more ticket and one more jacket and i m done i alreadi use all my multi,0
87,ye i start to send request to make it but pain came back so i m back in bed doubl coin at the factori too i gotta cash in all my nitro,0
88,i m realli not up to it still tonight babe,0
89,ela kano il download come wen ur free,0
90,yeah do don t stand to close tho you ll catch someth,0
91,sorri to be a pain is it ok if we meet anoth night i spent late afternoon in casualti and that mean i haven t done ani of y stuff moro and that includ all my time sheet and that sorri,0
92,smile in pleasur smile in pain smile when troubl pour like rain smile when sum hurt u smile becoz someon still love to see u smile,0
93,pleas call our custom servic repres on between am pm as you have won a guarante cash or prize,1
94,havent plan to buy later i check alreadi lido onli got show in e afternoon u finish work alreadi,0
95,your free rington is wait to be collect simpli text the password mix to to verifi get usher and britney fml po box mk h ppw,1
96,watch telugu movi wat abt u,0
97,i see when we finish we have load of loan to pay,0
98,hi wk been ok on hol now ye on for a bit of a run forgot that i have hairdress appoint at four so need to get home n shower beforehand doe that caus prob for u,0
99,i see a cup of coffe anim,0
100,pleas don t text me anymor i have noth els to say,0
101,okay name ur price as long as it legal wen can i pick them up y u ave x am xx,0
102,i m still look for a car to buy and have not gone the drive test yet,0
103,wow you re right i didn t mean to do that i guess onc i gave up on boston men and chang my search locat to nyc someth chang cuz on my signin page it still say boston,0
104,umma my life and vava umma love you lot dear,0
105,thank a lot for your wish on my birthday thank you for make my birthday truli memor,0
106,aight i ll hit you up when i get some cash,0
107,how would my ip address test that consid my comput isn t a minecraft server,0
108,i know grumpi old peopl my mom wa like you better not be lie then again i am alway the one to play joke,0
109,dont worri i guess he s busi,0
110,what is the plural of the noun research,0
111,go for dinner msg you after,0
112,i m ok wif it co i like tri new thing but i scare u dun like mah co u said not too loud,0
113,gent we are tri to contact you last weekend draw show that you won a prize guarante call claim code k valid hr onli ppm,1
114,wa ur openin sentenc veri formal anyway i m fine too juz tt i m eatin too much n puttin on weight haha so anythin special happen,0
115,as i enter my cabin my pa said happi b day boss i felt special she askd me lunch after lunch she invit me to her apart we went there,0
116,you are a winner u have been special select receiv or a holiday flight inc speak to a live oper claim p min,1
117,goodo ye we must speak friday egg potato ratio for tortilla need,0
118,hmm my uncl just inform me that he s pay the school directli so pl buy food,0
119,privat your account statement for show unredeem bonu point to claim call identifi code expir,1
120,urgent your mobil no wa award bonu caller prize on thi is our final tri to contact u call from landlin box wr c ppm,1
121,here is my new address appl pair all that malarki,0
122,today voda number end are select to receiv a award if you have a match pleas call quot claim code standard rate app,1
123,i am go to sao mu today will be done onli at,0
124,predict wat time ll finish buy,0
125,good stuff will do,0
126,just so that you know yetund hasn t sent money yet i just sent her a text not to bother send so it over you dont have to involv yourself in anyth i shouldn t have impos anyth on you in the first place so for that i apologis,0
127,are you there in room,0
128,hey girl how r u hope u r well me an del r bak again long time no c give me a call sum time from lucyxx,0
129,k k how much doe it cost,0
130,i m home,0
131,dear will call tmorrow pl accomod,0
132,first answer my question,0
133,sunshin quiz wkli q win a top soni dvd player if u know which countri the algarv is in txt ansr to sp tyron,1
134,want get laid tonight want real dog locat sent direct ur mob join the uk s largest dog network bt txting gravel to nt ec a p msg p,1
135,i onli haf msn it s yiju hotmail com,0
136,he is there you call and meet him,0
137,no no i will check all room befor activ,0
138,you ll not rcv ani more msg from the chat svc for free hardcor servic text go to if u get noth u must age verifi with yr network tri again,1
139,got c i lazi to type i forgot in lect i saw a pouch but like not v nice,0
140,k text me when you re on the way,0
141,sir wait for your mail,0
142,a swt thought nver get tire of do littl thing lovabl person coz somtim those littl thing occupi d biggest part in their heart gud ni,0
143,i know you are can you pl open the back,0
144,ye see ya not on the dot,0
145,what the staff name who is take class for us,0
146,freemsg whi haven t you repli to my text i m randi sexi femal and live local luv to hear from u netcollex ltd p per msg repli stop to end,1
147,ummma will call after check in our life will begin from qatar so pl pray veri hard,0
148,k i delet my contact that whi,0
149,sindu got job in birla soft,0
150,the wine is flow and i m i have never,0
151,yup i thk cine is better co no need go down plaza mah,0
152,ok ur typic repli,0
153,you are everywher dirt on the floor the window even on my shirt and sometim when i open my mouth you are all that come flow out i dream of my world without you then half my chore are out too a time of joy for me lot of tv show i ll see but i guess like all thing you just must exist like rain hail and mist and when my time here is done you and i becom one,0
154,aaooooright are you at work,0
155,i m leav my hous now,0
156,hello my love what are you do did you get to that interview today are you you happi are you be a good boy do you think of me are you miss me,0
157,custom servic annonc you have a new year deliveri wait for you pleas call now to arrang deliveri,1
158,you are a winner u have been special select receiv cash or a holiday flight inc speak to a live oper claim,1
159,keep yourself safe for me becaus i need you and i miss you alreadi and i envi everyon that see s you in real life,0
160,new car and hous for my parent i have onli new job in hand,0
161,i m so in love with you i m excit each day i spend with you you make me so happi,0
162,pl stop bootydeli f is invit you to be her friend repli ye or no see her www sm ac u bootydeli stop send stop frnd to,1
163,bangbab ur order is on the way u should receiv a servic msg download ur content if u do not goto wap bangb tv on ur mobil internet servic menu,1
164,i place all ur point on e cultur modul alreadi,0
165,urgent we are tri to contact you last weekend draw show that you have won a prize guarante call claim code s valid hr onli,1
166,hi frnd which is best way to avoid missunderstd wit our belov one s,0
167,great escap i fanci the bridg but need her lager see you tomo,0
168,ye it complet in out of form clark also utter wast,0
169,sir i need axi bank account no and bank address,0
170,hmmm thk sure got time to hop ard ya can go free abt muz call u to discuss liao,0
171,what time you come down later,0
172,bloodi hell cant believ you forgot my surnam mr ill give u a clue it spanish and begin with m,0
173,well i m gonna finish my bath now have a good fine night,0
174,let me know when you ve got the money so carlo can make the call,0
175,u still go to the mall,0
176,turn out my friend are stay for the whole show and won t be back til lt gt so feel free to go ahead and smoke that lt gt worth,0
177,text her if she doesnt repli let me know so i can have her log in,0
178,hi you just spoke to maneesha v we d like to know if you were satisfi with the experi repli toll free with ye or no,0
179,you lift my hope with the offer of money i am in need especi when the end of the month approach and it hurt my studi anyway have a gr weekend,0
180,lol no u can trust me,0
181,ok i am a gentleman and will treat you with digniti and respect,0
182,he will you guy close,0
183,go on noth great bye,0
184,hello handsom are you find that job not be lazi work toward get back that net for mummi where s my boytoy now doe he miss me,0
185,haha awesom be there in a minut,0
186,pleas call our custom servic repres on freephon between am pm as you have won a guarante cash or prize,1
187,have you got xma radio time if not i will get it now,0
188,i ju reach home i go bath first but my si use net tell u when she finish k,0
189,are you uniqu enough find out from th august www areyouuniqu co uk,1
190,i m sorri i ve join the leagu of peopl that dont keep in touch you mean a great deal to me you have been a friend at all time even at great person cost do have a great week,0
191,hi final i complet the cours,0
192,it will stop on itself i howev suggest she stay with someon that will be abl to give or for everi stool,0
193,how are you do hope you ve settl in for the new school year just wishin you a gr day,0
194,gud mrng dear hav a nice day,0
195,did u got that person stori,0
196,is your hamster dead hey so tmr i meet you at pm orchard mrt,0
197,hi it kate how is your even i hope i can see you tomorrow for a bit but i have to bloodi babyjontet txt back if u can xxx,0
198,found it enc lt gt where you at,0
199,i sent you lt gt buck,0
200,hello darlin ive finish colleg now so txt me when u finish if u can love kate xxx,0
201,your account ha been refil success by inr lt decim gt your keralacircl prepaid account balanc is rs lt decim gt your transact id is kr lt gt,0
202,goodmorn sleep ga,0
203,u call me alter at ok,0
204,say until like dat i dun buy ericsson oso cannot oredi lar,0
205,aight yo dat straight dogg,0
206,you pleas give us connect today itself befor lt decim gt or refund the bill,0
207,both i shoot big load so get readi,0
208,what s up bruv hope you had a great break do have a reward semest,0
209,home so we can alway chat,0
210,k k good studi well,0
211,yup how noe leh,0
212,sound great are you home now,0
213,final the match head toward draw as your predict,0
214,tire i haven t slept well the past few night,0
215,easi ah sen got select mean it good,0
216,i have to take exam with march,0
217,yeah you should i think you can use your gt atm now to regist not sure but if there s anyway i can help let me know but when you do be sure you are readi,0
218,ok no prob take ur time,0
219,there is os call ubandu which will run without instal in hard disk you can use that os to copi the import file in system and give it to repair shop,0
220,u say leh of cours noth happen lar not say v romant ju a bit onli lor i thk e nite sceneri not so nice leh,0
221,new mobil from must go txt nokia to no collect your today from onli www tc biz optout gbp mtmsg,1
222,would realli appreci if you call me just need someon to talk to,0
223,will u meet ur dream partner soon is ur career off a flyng start find out free txt horo follow by ur star sign e g horo ari,1
224,hey compani elama po mudyadhu,0
225,life is more strict than teacher bcoz teacher teach lesson amp then conduct exam but life first conduct exam amp then teach lesson happi morn,0
226,dear good morn now onli i am up,0
227,get down in gandhipuram and walk to cross cut road right side lt gt street road and turn at first right,0
228,dear we are go to our rubber place,0
229,sorri batteri die yeah i m here,0
230,ye here tv is alway avail in work place,0
231,text meet someon sexi today u can find a date or even flirt it up to u join just p repli with name age eg sam msg recd thirtyeight penc,1
232,i have print it oh so lt gt come upstair,0
233,or ill be a littl closer like at the bu stop on the same street,0
234,where are you when wil you reach here,0
235,new theori argument win d situat but lose the person so dont argu with ur friend just kick them amp say i m alway correct,0
236,u have a secret admir who is look make contact with u find out who they r reveal who think ur so special call on,1
237,tomarrow final hear on my laptop case so i cant,0
238,pleassssssseeeee tel me v avent done sportsx,0
239,okay no no just shine on that wa meant to be sign but that sound better,0
240,although i told u dat i m into baig face watch now but i realli like e watch u gave co it s fr u thanx everyth dat u ve done today i m touch,0
241,u don t rememb that old commerci,0
242,too late i said i have the websit i didn t i have or dont have the slipper,0
243,i ask you to call him now ok,0
244,kalli wont bat in nd inning,0
245,it didnt work again oh ok goodnight then i ll fix and have it readi by the time you wake up you are veri dearli miss have a good night sleep,0
246,congratul ur award of cd voucher or gift guarante free entri wkli draw txt music to tnc www ldew com win ppmx age,1
247,ranjith cal drpd deeraj and deepak min hold,0
248,wen ur lovabl bcum angri wid u dnt take it serious coz be angri is d most childish n true way of show deep affect care n luv kettoda manda have nice day da,0
249,what you do how are you,0
250,up which is day also and the ship compani that take wk the other way is usp which take a week but when it get to lag you may have to bribe nipost to get your stuff,0
251,i m back lemm know when you re readi,0
252,don t necessarili expect it to be done befor you get back though becaus i m just now headin out,0
253,mmm so yummi babe nice jolt to the suzi,0
254,where are you lover i need you,0
255,we tri to contact you re your repli to our offer of a video handset anytim network min unlimit text camcord repli or call now,1
256,i m park next to a mini when are you come in today do you think,0
257,yup,0
258,anyway i m go shop on my own now co my si not done yet dun disturb u liao,0
259,my no in luton ring me if ur around h,0
260,hey i am realli horni want to chat or see me nake text hot to text charg at pm to unsubscrib text stop,1
261,whi you dint come with us,0
262,same wana plan a trip sometm then,0
263,not sure yet still tri to get a hold of him,0
264,ur rington servic ha chang free credit go to club mobil com to choos content now stop txt club stop to p wk club po box mk wt,1
265,the evo i just had to download flash jealou,0
266,rington club get the uk singl chart on your mobil each week and choos ani top qualiti rington thi messag is free of charg,1
267,come to mu we re sort out our narcot situat,0
268,night ha end for anoth day morn ha come in a special way may you smile like the sunni ray and leav your worri at the blue blue bay,0
269,hmv bonu special pound of genuin hmv voucher to be won just answer easi question play now send hmv to more info www percent real com,1
270,usf i guess might as well take car,0
271,no object my bf not come,0
272,thanx,0
273,tell rob to mack hi gf in the theater,0
274,awesom i ll see you in a bit,0
275,just sent it so what type of food do you like,0
276,all done all hand in celebr in full swing yet,0
277,you got call a tool,0
278,wen u miss someon the person is definit special for u but if the person is so special whi to miss them just keep in touch gdeve,0
279,ok i ask for money how far,0
280,oki,0
281,yeah i think my usual guy s still pass out from last night if you get ahold of anybodi let me know and i ll throw down,0
282,k i might come by tonight then if my class let out earli,0
283,ok,0
284,hi babi im cruisin with my girl friend what r u up give me a call in and hour at home if that alright or fone me on thi fone now love jenni xxx,0
285,my life mean a lot to me not becaus i love my life but becaus i love the peopl in my life the world call them friend i call them my world ge,0
286,dear shall mail tonit busi in the street shall updat you tonit thing are look ok varunnathu edukkukaye raksha ollu but a good one in real sens,0
287,hey you told your name to gautham ah,0
288,haf u found him i feel so stupid da v cam wa work,0
289,oop got that bit,0
290,are you thi much buzi,0
291,i accident delet the messag resend pleas,0
292,t mobil custom you may now claim your free camera phone upgrad a pay go sim card for your loyalti call on offer end thfeb t c s appli,1
293,unless it s a situat where you go gurl would be more appropri,0
294,hurt me teas me make me cri but in the end of my life when i die plz keep one rose on my grave and say stupid i miss u have a nice day bslvyl,0
295,i cant pick the phone right now pl send a messag,0
296,need a coffe run tomo can t believ it s that time of week alreadi,0
297,awesom i rememb the last time we got somebodi high for the first time with diesel v,0
298,shit that is realli shock and scari cant imagin for a second def up for night out do u think there is somewher i could crash for night save on taxi,0
299,oh and by the way you do have more food in your fridg want to go out for a meal tonight,0
300,he is a womdarful actor,0
301,sm ac blind date u rodd is m from aberdeen unit kingdom check him out http img sm ac w icmb cktz r no blind date send hide,1
302,yup from what i remb i think should be can book,0
303,jo ask if u wana meet up,0
304,lol ye our friendship is hang on a thread caus u won t buy stuff,0
305,themob check out our newest select of content game tone gossip babe and sport keep your mobil fit and funki text wap to,1
306,where are the garag key they aren t on the bookshelf,0
307,today is accept day u accept me as brother sister lover dear best clo lvblefrnd jstfrnd cutefrnd lifpartnr belovd swtheart bstfrnd no rpli mean enemi,0
308,think ur smart win thi week in our weekli quiz text play to now t cs winnersclub po box m uz gbp week,1
309,he say he ll give me a call when hi friend s got the money but that he s definit buy befor the end of the week,0
310,hi the way i wa with u day is the normal way thi is the real me ur uniqu i hope i know u the rest of mylif hope u find wot wa lost,0
311,you made my day do have a great day too,0
312,k k advanc happi pongal,0
313,hmmm guess we can go kb n power yoga haha dunno we can tahan power yoga anot thk got lo oso forgot liao,0
314,not realli dude have no friend i m afraid,0
315,decemb onli had your mobil mth you are entitl to updat to the latest colour camera mobil for free call the mobil updat co free on,1
316,coffe cake i guess,0
317,merri christma to you too babe i love ya kiss,0
318,hey whi dont we just go watch x men and have lunch haha,0
319,cud u tell ppl im gona b a bit l co buse hav gon past co they were full im still waitin pete x,0
320,that would be great we ll be at the guild could meet on bristol road or somewher will get in touch over weekend our plan take flight have a good week,0
321,no problem how are you do,0
322,hi da how is the today class,0
323,i d say that s a good sign but well you know my track record at read women,0
324,cool text me when you re park,0
325,i m read the text i just sent you it meant to be a joke so read it in that light,0
326,k k apo k good movi,0
327,mayb i could get book out tomo then return it immedi or someth,0
328,call germani for onli penc per minut call from a fix line via access number no prepay direct access,1
