,sms,spam/ham_spam
1325,hey i will be realli pretti late you want to go for the lesson first i will join you i m onli reach tp mrt,0
1326,hot live fantasi call now just p per min ntt ltd po box croydon cr wb k,1
1327,bbq thi sat at mine from ish ur welcom come,0
1328,i don t know same thing that s wrong everyso often he panick start goin on bout not bein good enough,0
1329,alright i m out have a good night,0
1330,did you tri make anoth butt,0
1331,hope you are feel great pl fill me in abiola,0
1332,i though we shd go out n have some fun so bar in town or someth sound ok,0
1333,go to write msg put on dictionari mode cover the screen with hand press lt gt gentli remov ur hand it interest,0
1334,bear pic nick and tom pete and dick in fact all type tri gay chat with photo upload call p min stop text call,1
1335,new mobil from must go txt nokia to no collect your today from onli www tc biz optout gbp mtmsg txtauction,1
1336,we re final readi fyi,0
1337,aunti huai juan never pick up her phone,0
1338,doubl min doubl txt price linerent on latest orang bluetooth mobil call mobileupd for the veri latest offer or call optout lf,1
1339,ya tel wat ur problem,0
1340,i dnt wnt to tlk wid u,0
1341,we spend our day wait for the ideal path to appear in front of us but what we forget is path are made by walk not by wait goodnight,0
1342,it ok my arm is feel weak cuz i got a shot so we can go anoth time,0
1343,pleas reserv ticket on saturday eve from chennai to thirunelvali and again from tirunelvali to chennai on sunday eve i alreadi see in net no ticket avail i want to book ticket through tackl,0
1344,storm msg wen u lift d phne u say hello do u knw wt is d real mean of hello it s d name of a girl ye and u knw who is dat girl margaret hello she is d girlfrnd f grahmbel who invnt telphon moral one can get d name of a person bt not hi girlfrnd g o o d n i g h t,0
1345,that s ok i pop in to ask bout someth and she said you d been in are you around tonght wen thi girl come,0
1346,all e best ur exam later,0
1347,hope ur head doesn t hurt much am plough my way through a pile of iron stay in with a chinki tonight come round if you like,0
1348,oh k i think most of wi and nz player unsold,0
1349,haha where got so fast lose weight thk muz go a month den got effect gee later we go aust put bk e weight,0
1350,i wonder how you got onlin my love had you gone to the net cafe did you get your phone recharg were you on a friend net i think of you boytoy,0
1351,haha just kid papa need drug,0
1352,thk shld b can ya i wana go lesson haha can go for one whole stretch,0
1353,oh ok,0
1354,r we still meet dinner tonight,0
1355,that cool i am a gentleman and will treat you with digniti and respect,0
1356,shall i start from hear,0
1357,then we wait u lor no need feel bad lar,0
1358,no did you check i got hi detail messag now,0
1359,you have regist sinco as paye log in at icicibank com and enter urn lt gt to confirm bewar of fraud do not share or disclos urn to anyon,0
1360,no i decid that onli peopl who care about stuff vote and care about stuff is for loser,0
1361,kaiez enjoy ur tuition gee thk e second option sound beta i ll go yan jiu den msg u,0
1362,cool we will have fun practic make babi,0
1363,actual get readi to leav the hous,0
1364,k k ani special today,0
1365,urgent import inform for o user today is your lucki day find out whi log onto http www urawinn com there is a fantast surpris await for you,1
1366,then we gotta do it after that,0
1367,i ve got ten buck jay is be noncomitt,0
1368,where at were hungri too,0
1369,pl speak to that custom machan,0
1370,somewher out there beneath the pale moon light someon think in of u some where out there where dream come true goodnit amp sweet dream,0
1371,dear u ve been invit to xchat thi is our final attempt to contact u txt chat to p msgrcvdhg suit land row w j hl ldn yr,1
1372,so wat ur opinion abt him and how abt is charact,0
1373,jay is snicker and tell me that x is total fuck up the chord as we speak,0
1374,no few hour befor went to hair cut,0
1375,no wonder co i dun rem see a silver car but i thk i saw a black one,0
1376,lmao take a pic and send it to me,0
1377,speak onli when you feel your word are better than the silenc gud mrng,0
1378,no she s current in scotland for that,0
1379,do you work all thi week,0
1380,congratul ur award either of cd gift voucher free entri our weekli draw txt music to tnc www ldew com win ppmx age,1
1381,lol great now im get hungri,0
1382,ye now onli saw your messag,0
1383,i ll be at mu in like lt gt second,0
1384,thing r good thanx got exam in march ive done no revis is fran still with boyf ive gotta interviw exet bit worri x,0
1385,tell you what if you make a littl spreadsheet and track whose idea it wa to smoke to determin who smoke too much for the entir month of februari i ll come up,0
1386,for sale arsen dartboard good condit but no doubl or trebl,1
1387,don t look back at the build becaus you have no coat and i don t want you to get more sick just hurri home and wear a coat to the gym,0
1388,my pain person thought i alway tri to keep everybodi happi all the time but nobodi recognis me when i am alon,0
1389,thank for ve love wish you rock,0
1390,you intrepid duo you have a great time and see you both soon,0
1391,i ask sen to come chennai and search for job,0
1392,dad went out oredi,0
1393,i ju hope it true that missin me co i m realli missin him you haven t done anyth to feel guilti about yet,0
1394,wat so late still earli mah or we juz go dinner lor aiya i dunno,0
1395,arm fine how s cardiff and uni,0
1396,in fact when do you leav i think addi goe back to school tue or wed,0
1397,cool breez bright sun fresh flower twitter bird all these wait to wish u goodmorn amp have a nice day,0
1398,ya go for restaur,0
1399,it ok i just askd did u knw tht no,0
1400,free st week entri textpod a chanc win gb ipod or cash everi wk txt pod to ts cs www textpod net custcar,1
1401,those duck chinchilla,0
1402,i am in a marriag function,0
1403,look like u wil b get a headstart im leav here bout ish but if u r desper for my compani i could head in earlier we were goin to meet in rummer,0
1404,don t give a fli monkey wot they think and i certainli don t mind ani friend of mine and all that,0
1405,as a regist optin subscrib ur draw gift voucher will be enter on receipt of a correct an to what no in the bbc chart,1
1406,say thank,0
1407,msg me when rajini come,0
1408,ya when are take ure practic lesson i start in june,0
1409,that s good becaus i need drug,0
1410,stupid it not possibl,0
1411,can all decid faster co my si go home liao,0
1412,summer final here fanci a chat or flirt with sexi singl in yr area to get match up just repli summer now free join optout txt stop help,1
1413,u sleep now or you go to take haha i got spi wat me onlin check n repli mail lor,0
1414,clair here am havin borin time am now alon u wanna cum over nite chat now hope c u luv clair xx call minmoremobsemspobox po wa,1
1415,bought one rington and now get text cost pound offer more tone etc,1
1416,yalru lyfu astn chikku bt innu mundh lyf ali halla ke bilo marriag program edha so lyf is nt yet ovr chikku ali vargu lyfu meow meow d,0
1417,kinda first one get in at twelv aah speak tomo,0
1418,urgent your mobil no xxxxxxxxx won a bonu caller prize on thi is the nd attempt to reach you call asap,1
1419,ok good then i later come find c lucki i told to go earlier later pple take finish no more again,0
1420,wat make u thk i ll fall down but actual i thk i m quit prone fall lucki my dad at home i ask him come n fetch me alreadi,0
1421,you are guarante the latest nokia phone a gb ipod mp player or a prize txt word collect to no tc llc ny usa p mt msgrcvd,1
1422,i wont touch you with out your permiss,0
1423,hi it luci hubbi at meetin all day fri i will b alon at hotel u fanci cumin over pl leav msg day luci x call minmobsmorelkpobox hp fl,1
1424,wonder in my world th you th ur style th ur smile th ur person rd ur natur nd ur sm and st ur love friendship good morn dear,0
1425,take some small dose tablet for fever,0
1426,oh u must have taken your real valentin out shop first,0
1427,just sent you an email to an address with incomm in it is that right,0
1428,will do you gonna be at blake s all night i might be abl to get out of here a littl earli,0
1429,friendship is not a game to play it is not a word to say it doesn t start on march and end on may it is tomorrow yesterday today and e,0
1430,nice wait should you be text right now i m not gonna pay your ticket ya know,0
1431,i m watch lotr w my si di aft so u wan meet me dinner at nite a not,0
1432,whi you keep me away like thi,0
1433,i think it far more than that but find out check googl map for a place from your dorm,0
1434,my trip wa ok but quit tire lor uni start today but it s ok me co i m not take ani modul but ju concentr on my final yr project,0
1435,have you alway been say welp,0
1436,i m a guy browsin is compulsori,0
1437,puriti of friendship between two is not about smile after read the forward messag it about smile just by see the name gud evng musthu,0
1438,i should add that i don t realli care and if you can t i can at least get thi dude to fuck off but hey your money if you want it,0
1439,hello lover how goe that new job are you there now are you happi do you think of me i wake my slave and send you a teas kiss from across the sea,0
1440,i told your number to gautham,0
1441,tell them no need to investig about me anywher,0
1442,ok i juz receiv,0
1443,cant believ i said so mani thing to you thi morn when all i realli want to say wa good morn i love you have a beauti morn see you in the librari later,0
1444,your account ha been credit with free text messag to activ just txt the word credit to no t cs www biz,1
1445,in the end she might still vomit but it okay not everyth will come out,0
1446,how are you with money as in to you money aint a thing how are you sha,0
1447,it ha everyth to do with the weather keep extra warm it a cold but noth seriou pl lot of vitamin c,0
1448,hey gal anyon of u go down to e drive centr tmr,0
1449,i m alway on yahoo messeng now just send the messag to me and i ll get it you may have to send it in the mobil mode sha but i ll get it and will repli,0
1450,i m put it on now it should be readi for lt time gt,0
1451,time n smile r the two crucial thing in our life sometim time make us to forget smile and sometim someon s smile make us to forget time gud noon,0
1452,sm ac jsco energi is high but u may not know where channel it day ur leadership skill r strong psychic repli an w question end repli end jsco,1
1453,host base idp for linux system,0
1454,hot live fantasi call now just p per min ntt ltd po box croydon cr wb is a nation rate call,1
1455,don no da what you plan,0
1456,ill be there on lt gt ok,0
1457,oh my god i m almost home,0
1458,total video convert free download type thi in googl search,0
1459,thank for the vote now sing along with the star with karaok on your mobil for a free link just repli with sing now,1
1460,sound like someth that someon test me would sayi,0
1461,when u love someon dont make them to love u as much as u do but love them so much that they dont want to be love by anyon except you gud nit,0
1462,pete is thi your phone still it jenni from colleg and leann what are you up to now,0
1463,oop sorri just to check that you don t mind pick me up tomo at half eight from station would that be ok,0
1464,hey sweet i wa wonder when you had a moment if you might come to me i want to send a file to someon but it won t go over yahoo for them becaus their connect suck rememb when you set up that page for me to go to and download the format disc could you tell me how to do that or do you know some other way to download big file becaus they can download stuff directli from the internet ani help would be great my prey teas kiss,0
1465,how the champ just leav glasgow,0
1466,k all the best congrat,0
1467,i wonder if you ll get thi text,0
1468,i need to come home and give you some good lovin,0
1469,our brand new mobil music servic is now live the free music player will arriv shortli just instal on your phone to brows content from the top artist,1
1470,shall i ask one thing if you dont mistak me,0
1471,check wid corect spele i e sarcasm,0
1472,urgent your mobil no wa award a bonu caller prize on thi is our nd attempt to contact you call box qu bt nation rate,1
1473,are you angri with me what happen dear,0
1474,i thk u dun haf hint in e forum alreadi lor co i told ron n darren is go tell shuhui,0
1475,yup ok thanx,0
1476,hi ct employe how are you,0
1477,pl pl find out from aunt nike,0
1478,wow i love you sooo much you know i can bare stand it i wonder how your day goe and if you are well my love i think of you and miss you,0
1479,no scream mean shout,0
1480,hey what happen de are you alright,0
1481,should i have pick up a receipt or someth earlier,0
1482,i think chennai well settl,0
1483,oh dang i didn t mean o send that to you lol,0
1484,unfortun i ve just found out that we have to pick my sister up from the airport that even so don t think i ll be go out at all we should tri to go out one of th,0
1485,horribl bf i now v hungri,0
1486,rememb on that day,0
1487,you have won a nokia i thi is what you get when you win our free auction to take part send nokia to now hg suit land row w jhl,1
1488,how s it feel mr your not my real valentin just my yo valentin even tho u hardli play,0
1489,all sound good finger make it difficult to type,0
1490,midnight at the earliest,0
1491,you re not sure that i m not tri to make xavier smoke becaus i don t want to smoke after be told i smoke too much,0
1492,k come to nordstrom when you re done,0
1493,do u konw waht is rael friendship im gving yuo an exmpel jsut ese tih msg evrey splle of tih msg is wrnog bt sitll yuo can ra it wihtuot ayn mitsak goodnight amp have a nice sleep sweet dream,0
1494,now press confer da,0
1495,hello from orang for month s free access to game news and sport plu free text and photo messag repli ye term appli www orang co uk ow,1
1496,after complet degre there is no use in join financ,0
1497,good afternoon my love ani job prospect are you miss me what do you do are you be lazi and bleak hmmm or happi and fill with my love,0
1498,shant disturb u anymor jia you,0
1499,bishan lar nearer no need buy so earli co if buy now i gotta park my car,0
1500,me i dont know again oh,0
1501,dude sux for snake he got old and raiden got buff,0
1502,he say hi and to get your ass back to south tampa prefer at a kegger,0
1503,in e msg ju now u said thank for gift,0
1504,u too,0
1505,ok how you dear did you call chechi,0
1506,yeah we do tote when u wanna,0
1507,ok i found di pierr cardin one which look normal cost it on sale,0
1508,good sleep is about rhythm the person ha to establish a rhythm that the bodi will learn and use if you want to know more,0
1509,wat r u do,0
1510,messag from i am at truro hospit on ext you can phone me here as i have a phone by my side,0
1511,singl line with a big mean miss anyth ur best life but don t miss ur best life for anyth gud nyt,0
1512,just got some ga money ani chanc you and the gang want to go on a grand natur adventur,0
1513,dnt worri use ice piec in a cloth pack also take tablet,0
1514,dude just saw a park car with it sunroof pop up sux,0
1515,get readi to put on your excel sub face,0
1516,tmrw im finish door,0
1517,the lt gt g that i saw a few day ago the guy want sell wifi onli for lt gt and with g for lt gt that s whi i blank him,0
1518,i am late i will be there at,0
1519,whatev im pretti piss off,0
1520,i dont have that much imag in class,0
1521,no i got rumour that you go to buy apart in chennai,0
1522,near kalainar tv offic thenampet,0
1523,ur cash balanc is current pound to maxim ur cash in now send go to onli p msg cc hg suit land row w j hl,1
1524,sm auction a brand new nokia is up auction today auction is free join take part txt nokia to now hg suit land row w j hl,1
1525,my si is catch e show in e afternoon so i m not watch w her so c u wan watch today or tmr lor,0
1526,sound gd haha can wah u yan jiu so fast liao,0
1527,no to be nosi i guess idk am i over react if i m freak,0
1528,rememb all those whom i hurt dure day of satan impost in me need to pay a price so be it may destini keep me go and as u said pray that i get the mind to get over the same,0
1529,how to make a girl happi it s not at all difficult to make girl happi u onli need to be a friend companion lover chef lt gt good listen lt gt organ lt gt good boyfriend lt gt veri clean lt gt sympathet lt gt athlet lt gt warm lt gt courag lt gt determin lt gt true lt gt depend lt gt intellig lt gt psychologist lt gt pest extermin lt gt psychiatrist lt gt healer lt gt stylist lt gt driver aaniy pudunga venaam,0
1530,whi is that princess i bet the brotha are all chase you,0
1531,i shall book chez jule for half eight if that s ok with you,0
1532,hhahhaahahah rofl wtf nig wa leonardo in your room or someth,0
1533,yep at derek s hous now see you sunday lt,0
1534,it s cool let me know befor it kick off around lt gt i ll be out and about all day,0
1535,i wa wonder if it would be okay for you to call uncl john and let him know that thing are not the same in nigeria as they r here that lt gt dollar is year sent and that you know it a strain but i plan to pay back everi dime he give everi dime so for me to expect anyth from you is not practic someth like that,0
1536,there are no other charg after transfer charg and you can withdraw anyhow you like,0
1537,dont search love let love find u that whi it call fall in love bcoz u dont forc yourself u just fall and u know there is smeon to hold u bslvyl,0
1538,at let s go to bill miller,0
1539,i love you you set my soul on fire it is not just a spark but it is a flame a big rawr flame xoxo,0
1540,somewhr someon is sure made u and god ha decid a perfect time to make u meet dat person till den enjoy ur crush,0
1541,that s my honeymoon outfit,0
1542,will it help if we propos go back again tomorrow,0
1543,privat your account statement for show un redeem s i m point call identifi code expir,1
1544,never blame a day in ur life good day give u happi bad day give u experi both are essenti in life all are god bless good morn,0
1545,pl confirm the time to collect the chequ,0
1546,as a regist subscrib yr draw a gift voucher will b enter on receipt of a correct an when are the next olymp txt an to,1
1547,urgent your mobil number ha been award with a prize guarante call from land line claim valid hr onli ppm,1
1548,daddi will take good care of you,0
1549,yeah probabl i still gotta check out with leo,0
1550,k then ani other special,0
1551,carlo is take hi sweet time as usual so let me know when you and patti are done want to smoke and i ll tell him to haul ass,0
1552,ok pa noth problem,0
1553,have you heard about that job i m go to that wildlif talk again tonight if u want come it that worzel and a wizzl or whatev it is,0
1554,god pick up a flower and dippeditinadew lovingli touch itwhichturnedinto u and the he gift tomeandsaid thi friend is u,0
1555,when you came to hostel,0
1556,ok no prob i ll come after lunch then,0
1557,ju tell u dat i ll b leav shanghai on st instead so we ll haf more time meet up cya,0
1558,are your freez are you home yet will you rememb to kiss your mom in the morn do you love me do you think of me are you miss me yet,0
1559,you all readi for big day tomorrow,0
1560,i ll probabl be around mu a lot,0
1561,,0
1562,rt king pro video club need help info ringtonek co uk or call you must be club credit redeem at www ringtonek co uk enjoy,1
1563,thnx dude u guy out nite,0
1564,me sef dey laugh you meanwhil how s my darl anji,0
1565,mm i had my food da from out,0
1566,k make sens btw carlo is be difficult so you guy are gonna smoke while i go pick up the second batch and get ga,0
1567,did u download the fring app,0
1568,the oz guy is be kinda flaki but one friend is interest in pick up lt gt worth tonight if possibl,0
1569,friend that u can stay on fb chat with,0
1570,fuck babe i miss you sooooo much i wish you were here to sleep with me my bed is so lone i go now to sleep to dream of you my love,0
1571,live is veri simpl love is also simpl laugh is too simpl win is tooo simpl but be simpl is veri difficult gud nte,0
1572,u have a secret admir who is look make contact with u find out who they r reveal who think ur so special call on,1
1573,ah well that confus thing doesn t it,0
1574,free text msg just text ok to and we ll credit your account,1
1575,hi dear call me it urgnt i don t know what your problem you don t want to work or if you have ani other problem at least tell me wate for your repli,0
1576,dear how you are you ok,0
1577,you have been select to stay in of top british hotel for noth holiday worth to claim call london bx sw ss,1
1578,ye princess i want to make you happi,0
1579,sound like you have mani talent would you like to go on a dinner date next week,0
1580,i am go to film day da at pm sorri da,0
1581,we not watch movi alreadi xy want shop so i m shop w her now,0
1582,hello my littl parti anim i just thought i d buzz you as you were with your friend grin remind you were love and send a naughti ador kiss,0
1583,yesterday it with me onli now am go home,0
1584,eeri nokia tone u rpli tone titl to eg tone dracula to titl ghost addamsfa munster exorcist twilight www getz co uk pobox w wq p,1
1585,you have come into my life and brought the sun shini down on me warm my heart put a constant smile on my face make me feel love and care for,0
1586,no shit but i wasn t that surpris so i went and spent the even with that french guy i met in town here and we fool around a bit but i didn t let him fuck me,0
1587,a network allow compani to bill for sm so they are respons for their supplier just as a shop ha to give a guarante on what they sell b g,1
1588,great comedi cant stop laugh da,0
1589,freemsg feelin kinda lnli hope u like keep me compani jst got a cam mobi wanna c my pic txt or repli date to msg p rcv hlp stop to,1
1590,alright we re all set here text the man,0
1591,hi where are you we re at and they re not keen to go out i kind of am but feel i shouldn t so can we go out tomo don t mind do you,0
1592,sleep nt feel well,0
1593,u will switch your fone on dammit,0
1594,india have to take lead,0
1595,i ll post her out l r in class,0
1596,tht wat wright brother did to fli,0
1597,even v good if somewhat event laden will fill you in don t you worri head ok but throat wreck see you at six then,0
1598,if u laugh realli loud if u talk spontan if u dont care what other feel u are probabl with your dear amp best friend goodeven dear,0
1599,it a laptop take it with you,0
1600,i dont have ani of your file in my bag i wa in work when you call me i ll tell you if i find anyth in my room,0
1601,i wan but too earli lei me outsid now wun b home so earli neva mind then,0
1602,for ur chanc to win a cash everi wk txt action to t s c s www movietrivia tv custcar x p wk,1
1603,i wa at bugi juz now wat but now i m walk home oredi so late then repli i oso saw a top dat i like but din buy where r now,0
1604,at we will go ok na,0
1605,ye i post a coupl of pic on fb there s still snow outsid too i m just wake up,0
1606,s if we have one good partnership go we will take lead,0
1607,rgent thi is the nd attempt to contact u u have won call b t csbcm wc n xx callcost ppm mobilesvari max,1
1608,yeah where s your class at,0
1609,no just send to you bec you in templ na,0
1610,you aren t come home between class right i need to work out and shower,0
1611,hi if ur lookin sauci daytim fun wiv busti marri woman am free all next week chat now sort time janinexx call minmobsmorelkpobox hp fl,1
1612,s but mostli not like that,0
1613,v ma fan,0
1614,dunno co i wa v late n when i reach they insid alreadi but we ate spageddi lor it s e gal who r laugh at me lor,0
1615,guess who spent all last night phase in and out of the fourth dimens,0
1616,so now my dad is gonna call after he get out of work and ask all these crazi question,0
1617,ye but they said it it,0
1618,veri hurt n meaning line ever i compromis everyth for my love but at d end my love compromis me for everyth gud mornin,0
1619,lmao nice,0
1620,glad to see your repli,0
1621,urgent we are tri to contact u today draw show that you have won a prize guarante call from land line claim a valid hr onli,1
1622,monthli password for wap mobsi com is use your wap phone not pc,1
1623,nah dub but je still buff,0
1624,pain word i thought be happi wa the most toughest thing on earth but the toughest is act happi with all unspoken pain insid,0
1625,yeah that s fine it s to get in is that ok,0
1626,lol where do u come up with these idea,0
1627,so mani peopl seem to be special at first sight but onli veri few will remain special to you till your last sight maintain them till life end sh ja,0
1628,okay we wait ah,0
1629,y lei,0
1630,hi babe u r most like to be in bed but im so sorri about tonight i realli wanna see u tomorrow so call me at love me xxx,0
1631,alreadi am squat is the new way of walk,0
1632,do you want bold or bb torch,0
1633,cramp stop go back to sleep,0
1634,today vodafon number end with my last four digit are select to receiv a award if your number match pleas call to claim your award,1
1635,free top rington sub to weekli rington get st week free send subpoli to per week stop sm,1
1636,nan sonathaya soladha whi boss,0
1637,bring tat cd don forget,0
1638,i don t know but i m rape dude at poker,0
1639,weightloss no more girl friend make load of money on ebay or someth and give thank to god,0
1640,wa gr to see that messag so when r u leav congrat dear what school and wat r ur plan,0
1641,eatin later but i m eatin wif my fren now lei go home first,0
1642,finish alreadi yar they keep say i mushi i so embarrass ok,0
1643,sorri man my stash ran dri last night and i can t pick up more until sunday,0
1644,hai priya are you right what doctor said pa where are you,0
