,sms,spam/ham_spam
3694,babe i lost you will you tri reboot,0
3695,ye nigh you cant aha,0
3696,i thk gotta go home by urself co i ll b go out shop my fren present,0
3697,nooooooo i m gonna be bore to death all day cabl and internet outag,0
3698,so ani amount i can get pl,0
3699,playin space poker u,0
3700,how come guoyang go n tell her then u told her,0
3701,you need to get up now,0
3702,they r give a second chanc to rahul dengra,0
3703,yeah in fact he just ask if we need anyth like an hour ago when and how much,0
3704,when the first strike is a red one the bird antelop begin toplay in the fieldof selfindepend believ thi the flower of content will grow random,0
3705,y wan to go there c doctor,0
3706,doe daddi have a bb now,0
3707,free msg get gnarl barkley crazi rington total free just repli go to thi messag right now,1
3708,she s borderlin but yeah whatev,0
3709,until lor ya can go dinner togeth,0
3710,i will be gentl princess we will make sweet gentl love,0
3711,how u doin babi girl hope u are okay everi time i call ure phone is off i miss u get in touch,0
3712,sorri went to bed earli nightnight,0
3713,i like to think there s alway the possibl of be in a pub later,0
3714,hmm yeah if your not too groov out and im look forward to my pound special,0
3715,i got to video tape pple type in messag lor u so free wan help me hee co i noe u wan watch infern affair so ask u along ask shuhui oso,0
3716,hi dude hw r u da reali mise u today,0
3717,me hungri buy some food good lei but mum n yun dun wan juz buy a littl bit,0
3718,refus a loan secur or unsecur can t get credit call free now or text back help we will,1
3719,i probabl won t eat at all today i think i m gonna pop how wa your weekend did u miss me,0
3720,i knew it u slept v late yest wake up so late,0
3721,haha dont be angri with yourself take it as a practic for the real thing,0
3722,where is that one day train,0
3723,so i could kiss and feel you next to me,0
3724,have a nice day my dear,0
3725,i sent lanr fakey s eckankar detail to the mail box,0
3726,your dad is back in ph,0
3727,you have been special select to receiv a award call befor the line close cost ppm t cs appli ag promo,1
3728,if you ask her or she say ani pleas messag,0
3729,if e time can then i go w u lor,0
3730,i wa just callin to say hi take care bruv,0
3731,you have won as a valu vodafon custom our comput ha pick you to win a prize to collect is easi just call,1
3732,did u turn on the heater the heater wa on and set to lt gt degre,0
3733,thank for your messag i realli appreci your sacrific i m not sure of the process of direct pay but will find out on my way back from the test tomorrow i m in class now do have a wonder day,0
3734,that s the troubl with class that go well you re due a dodgey one expect mine tomo see you for recoveri same time same place,0
3735,free video camera phone with half price line rental for mth and cross ntwk min txt call mobileupd or call optout,1
3736,wot u up j,0
3737,night night see you tomorrow,0
3738,roger that we re probabl go to rem in about,0
3739,do u think that ani girl will propos u today by se ur bloodi funki shit fuck face asssssholeee,0
3740,i wish u were here i feel so alon,0
3741,reason is if the team budget is avail at last they buy the unsold player for at base rate,0
3742,ceri u rebel sweet dreamz me littl buddi c ya moro who need bloke,0
3743,ringtonek,1
3744,huh i cant thk of more oredi how mani page do we have,0
3745,hi fren go then he in lor not alon wif my mum n si lor,0
3746,nationwid auto centr or someth like that on newport road i like them there,0
3747,hey i miss you tm of last night as my phone wa on the charg smile i am meet a friend shortli,0
3748,whatev juliana do whatev you want,0
3749,rington club gr new poli direct to your mobil everi week,1
3750,hello sort of out in town alreadi that so dont rush home i am eat nacho will let you know eta,0
3751,ok lor anyway i thk we cant get ticket now co like quit late alreadi u wan go look ur fren a not darren is wif them now,0
3752,bank of granit issu strong buy explos pick for our member up over nasdaq symbol cdgt that is a per,1
3753,dizzamn aight i ll ask my suitem when i get back,0
3754,nimbomson yep phone know that one obvious co that a real word,0
3755,i love to cuddl i want to hold you in my strong arm right now,0
3756,r u in thi contin,0
3757,we ll you pay over like lt gt yr so it not too difficult,0
3758,bore housew chat n date now bt nation rate p min onli from landlin,1
3759,we tri to call you re your repli to our sm for a video mobil min unlimit text free camcord repli or call now del thur,1
3760,k k when will you give treat,0
3761,thi is the nd time we have tri to contact u u have won the prize claim is easi just call now onli p per minut bt nation rate,1
3762,he s just gonna worri for noth and he won t give you money it no use,0
3763,did you get ani gift thi year i didnt get anyth so bad,0
3764,well there s a pattern emerg of my friend tell me to drive up and come smoke with them and then tell me that i m a weed fiend make them smoke too much imped their do other thing so you see how i m hesit,0
3765,ow u dey i paid thousad i told u would call,0
3766,im fine babe aint been up much tho saw scari movi yest it quit funni want mrw afternoon at town or mall or sumthin xx,0
3767,i m reach home in min,0
3768,forgot you were work today wanna chat but thing are ok so drop me a text when you re free bore etc and i ll ring hope all is well nose essay and all xx,0
3769,ha then we must walk to everywher cannot take tram my cousin said can walk to vic market from our hotel,0
3770,discuss with your mother ah,0
3771,sorri i can t text amp drive coher see you in twenti,0
3772,you will be receiv thi week s tripl echo rington shortli enjoy it,1
3773,in which place i can get room cheap,0
3774,eek that s a lot of time especi sinc american pie is like minut long i can t stop sing it,0
3775,gran onlyfound out afew day ago cusoon honi,0
3776,u ve been select to stay in of top british hotel for noth holiday valu at dial to claim nation rate call bx sw ss,1
3777,univers of southern california,0
3778,we have to pick rayan macleran there,0
3779,u gd lor go shop i got stuff to do u wan watch infern affair a not come lar,0
3780,well ball time to make call,0
3781,wat time wan today,0
3782,lt gt in mca but not conform,0
3783,oh ok wat s ur email,0
3784,ye princess are you go to make me moan,0
3785,lol it ok i didn t rememb til last nite,0
3786,anyway mani good even to u s,0
3787,cool i ll text you in a few,0
3788,sorri vikki i m watch olav mandara movi kano in trishul theatr wit my frnd,0
3789,i m veri happi for you babe woo hoo parti on dude,0
3790,i am take you for italian food how about a pretti dress with no panti,0
3791,wot u up thout u were gonna call me txt bak luv k,0
3792,you are chosen to receiv a award pl call claim number to collect your award which you are select to receiv as a valu mobil custom,1
3793,how are you hold up,0
3794,dont flatter yourself tell that man of mine two pint of carlin in ten minut pleas,0
3795,hope you are not scare,0
3796,i m at home n readi,0
3797,what time do u get out,0
3798,i am liter in bed and have been up for like lt gt hour,0
3799,ye my reg is ciao,0
3800,if you mean the websit ye,0
3801,win a cash prize or a prize worth,1
3802,thank for your rington order refer number x your mobil will be charg should your tone not arriv pleas call custom servic,1
3803,lol or i could just starv and lose a pound by the end of the day,0
3804,yeah that s the impress i got,0
3805,ok ok take care i can understand,0
3806,motiv behind everi dark there is a shine light wait for you to find it behind everi best friend there is alway trust and love bslvyl,0
3807,ya ok then had dinner,0
3808,i wa slept that time you there,0
3809,dont make ne plan for nxt wknd coz she want us to come down then ok,0
3810,when is school start where will you stay what s the weather like and the food do you have a social support system like friend in the school all these thing are import,0
3811,ha ha nan yalrigu heltini iyo kothi chikku u share mani thing wit me so far i didn t told ani bodi and even utter a word abt u if ur trust me so much how can i tell these to other plz nxt time dont use those word to me ok chikku b,0
3812,noic text me when you re here,0
3813,hi di is yiju we re meet at pm at esaplanad tonight,0
3814,mobi pub quiz win a high street prize if u know who the new duchess of cornwal will be txt her first name to unsub stop sp,1
3815,thi week savamob member offer are now access just call for detail savamob pobox la wu onli week savamob offer mobil,1
3816,aight i ve been set free think you could text me blake s address it occur to me i m not quit as sure what i m do as i thought i wa,0
3817,hi dear we saw dear we both are happi where you my batteri is low,0
3818,how are you it been age how s abj,0
3819,prof you have pass in all the paper in thi sem congrat student enna kalaachutaarama prof gud mrng,0
3820,dont kick coco when he s down,0
3821,fyi i m gonna call you sporad start at like lt gt bc we are not not doin thi shit,0
3822,you are be contact by our date servic by someon you know to find out who it is call from your mobil or landlin pobox ldn,1
3823,tb persolvo been chase us sinc sept for definit not pay now thank to your inform we will ignor them kath manchest,1
3824,hope you re not have too much fun without me see u tomorrow love jess x,0
3825,ok i wont call or disturb ani one i know all are avoid me i am a burden for all,0
3826,i ve reach home n i bath liao u can call me now,0
3827,loan for ani purpos even if you have bad credit tenant welcom call noworriesloan com on,1
3828,wa the actual exam harder than nbme,0
3829,a lot of thi sick thing go round take it easi hope u feel better soon lol,0
3830,kick off a new season with wk free goal news to ur mobil txt ur club name to eg villa to,1
3831,hey sathya till now we dint meet not even a singl time then how can i saw the situat sathya,0
3832,gam gone after outstand inning,0
3833,o i play smash bro lt gt religi,0
3834,sir good morn hope you had a good weekend i call to let you know that i wa abl to rais lt gt from my dad he howev said he would make the rest avail by mid feb thi amount is still quit short and i wa hope you would help do have a good day abiola,0
3835,hurri home soup is done,0
3836,good afternoon my love it wa good to see your word on ym and get your tm veri smart move my slave smile i drink my coffe and await you,0
3837,quit ok but a bit ex u better go eat smth now els i ll feel guilti,0
3838,orang bring you rington from all time chart hero with a free hit each week go to rington pic on wap to stop receiv these tip repli stop,1
3839,lemm know when you re here,0
3840,privat your account statement for show un redeem s i m point call identifi code expir,1
3841,he need to stop go to bed and make with the fuck deal,0
3842,how are you my love are you with your brother time to talk english with him grin say hey muhommad penni say hello from across the sea,0
3843,we tri to call you re your repli to our sm for a video mobil min unlimit text free camcord repli of call now,1
3844,hey doc pl i want to get nice t shirt for my hubbi nice fite one my budget is lt gt k help pl i will load d card abi hw keep me post luv mj,0
3845,i remain unconvinc that thi isn t an elabor test of my willpow,0
3846,life is noth wen v get everyth but life is everyth wen v miss someth real valu of peopl wil be realiz onli in their absenc gud mrng,0
3847,how are you i miss you,0
3848,i ain t answerin no phone at what is actual a pretti reason hour but i m sleepi,0
3849,hey is rite u put evey mnth is that all,0
3850,i am go to bed now prin,0
3851,i think just yourself thank and see you tomo,0
3852,if u dun drive then how i go sch,0
3853,i not at home now lei,0
3854,gsoh good with spam the ladi u could b a male gigolo join the uk s fastest grow men club repli oncal mjzgroup stop repli stop msg rcvd,1
3855,do u hav ani frnd by name ashwini in ur colleg,0
3856,ju finish my lunch on my way home lor i tot u dun wan stay in sch today,0
3857,k then marrow are you come to class,0
3858,hot live fantasi call now just p per min ntt ltd po box croydon cr wb is a nation rate call,1
3859,pl send me your address sir,0
3860,i want to lick your pussi now,0
3861,yo you gonna still be in stock tomorrow today i m tri to get a dubsack,0
3862,urgent your mobil number ha been award a ukp prize guarante call from landlin claim valid hr onli ppm,1
3863,i ll see but prolli yeah,0
3864,thought we could go out for dinner i ll treat you seem ok,0
3865,where are you what do you do how can you stand to be away from me doesn t your heart ach without me don t you wonder of me don t you crave me,0
3866,sorri you never hear unless you book it one wa kinda a joke thet were realli look for skinni white girl the other wa one line you can onli do so much on camera with that someth like that they re cast on the look,0
3867,sure thing big man i have hockey elect at shouldn t go on longer than an hour though,0
3868,watch lor i saw a few swatch one i thk quit ok ard but i need nd opinion leh,0
3869,hiya do u like the hlday pic look horribl in them so took mo out how the camp amrca thing speak soon serena,0
3870,babe how goe that day what are you up to i miss you alreadi my love love kiss i hope everyth goe well,0
3871,yunni i m goin to be late,0
3872,doc prescrib me morphin caus the other pain med aren t enough wait for my mom to bring it that med should kick in fast so i m gonna tri to be on later,0
3873,cool want me to go to kappa or should i meet you outsid mu,0
3874,hey sexi bun have i told you i ador you loverboy i hope you rememb to thank your sister in law for those meatbal grin i love you babe,0
3875,may b approv panalam but it should have more post,0
3876,spjanuari male sale hot gay chat now cheaper call nation rate from p min cheap to p min peak to stop text call p min,1
3877,me i m not workin onc i get job,0
3878,and by when you re done i mean now,0
3879,it ur luck to love someon it ur fortun to love the one who love u but it a miracl to love a person who can t love anyon except u gud nyt,0
3880,hi babi ive just got back from work and i wa want to see u allday i hope i didnt piss u off on the phone today if u are up give me a call xxx,0
3881,freemsg today s the day if you are readi i m horni live in your town i love sex fun game netcollex ltd p per msg repli stop to end,1
3882,is it your yahoo boy that bring in the perf or legal,0
3883,no need to say anyth to me i know i am an outsid,0
3884,have you ever had one foot befor,0
3885,just got to lt gt,0
3886,good no don t need ani receipt well done ye pleas tell what s her number i could ring her,0
3887,leav it wif me lar wan to carri meh so heavi is da num familiar to,0
3888,beauti truth express of the face could be seen by everyon but the depress of heart could be understood onli by the love one gud ni,0
3889,infact happi new year how are you where are you when are we see,0
3890,in the simpson movi releas in juli name the band that die at the start of the film a green day b blue day c red day send a b or c,1
3891,that s a shame mayb cld meet for few hr tomo,0
3892,lol i would but despit these cramp i like be a girl,0
3893,i can t wait for cornwal hope tonight isn t too bad as well but it s rock night shite anyway i m go for a kip now have a good night speak to you soon,0
3894,pl help me tell sura that i m expect a batteri from hont and that if should pl send me a messag about how to download movi thank,0
3895,pleas call amanda with regard to renew or upgrad your current t mobil handset free of charg offer end today tel subject to t s and c s,1
3896,haven t found a way to get anoth app for your phone eh will you go to the net cafe did you take that job geeee i need you babe i crave to see you,0
3897,i onli work from mon to thur but sat i cant leh book liao which other day u free,0
3898,comin to fetch us oredi,0
3899,what s nanni address,0
3900,haf u eaten wat time u wan me come,0
3901,want a new video phone anytim ani network min half price line rental free text for month repli or call for free deliveri,1
3902,yo call me when you get the chanc a friend of mine want me to ask you about a big order,0
3903,thi singl singl answer are we fight plu i said am broke and you didnt repli,0
3904,it certainli put thing into perspect when someth like thi happen,0
3905,now got tv watch meh u no work today,0
3906,i felt so not ani convey reason ese he what about me,0
3907,how s it go got ani excit karaok type activ plan i m debat whether to play footbal thi eve feel lazi though,0
3908,i told that am come on wednesday,0
3909,it ok call mom instead have fun,0
3910,dear voucher holder to claim thi week offer at your pc pleas go to http www wtlp co uk text ts cs appli,1
3911,well if i m that desper i ll just call armand again,0
3912,are you at work right now,0
3913,haven t heard anyth and he s not answer my text so i m guess he flake that said the jb is fantast,0
3914,mmmmmm i love you so much ahmad i can t wait for thi year to begin as everi second take me closer to be at your side happi new year my love,0
3915,pl what s the full name of joke s school co fee in univers of florida seem to actual be lt gt k pl holla back,0
3916,ok but they said i ve got wisdom teeth hidden insid n mayb need remov,0
3917,and pl pl drink plenti plenti water,0
3918,how are you do how s the queen are you go for the royal wed,0
3919,he s in lag that s just the sad part but we keep in touch thank to skype,0
3920,ok lor then we go tog lor,0
3921,two team wait for some player,0
3922,can send me a copi of da report,0
3923,swhrt how u dey hope ur ok tot about u day love n miss take care,0
3924,ok da i alreadi plan i wil pick you,0
3925,urgent pleas call your abta complimentari spanish holiday or cash await collect sae t cs box po ez ppm,1
3926,i just realli need shit befor tomorrow and i know you won t be awak befor like,0
3927,i m good have you regist to vote,0
3928,hmm ok i ll stay for like an hour co my eye is realli sore,0
3929,dear got bu directli to calicut,0
3930,mm umma ask vava also to come tell him can play later togeth,0
3931,well the gener price is lt gt oz let me know if when how much you want,0
3932,each moment in a day ha it own valu morn bring hope afternoon bring faith even bring luv night bring rest wish u find them all today good morn,0
3933,lt gt w jetton ave if you forgot,0
3934,ok i m come home now,0
3935,can not use foreign stamp in thi countri,0
3936,sorri it s a lot of friend of a friend stuff i m just now about to talk to the actual guy who want to buy,0
3937,cmon babe make me horni turn me on txt me your fantasi now babe im hot sticki and need you now all repli cost cancel send stop,1
3938,wyli updat my weed dealer carlo went to freedom and had a class with lunsford,0
3939,are you happi babi are you alright did you take that job i hope your fine i send you a kiss to make you smile from across the sea kiss kiss,0
3940,c movi is juz last minut decis mah juz watch lar but i tot not interest,0
3941,how are you enjoy thi semest take care brother,0
3942,import inform orang user xxxxxx today is ur lucki day find out whi log onto http www urawinn com there s a fantast prizeawait you,1
3943,get the door i m here,0
3944,let use it next week princess,0
3945,or i go home first lar wait me lor i put down my stuff first,0
3946,i want kfc it tuesday onli buy meal onli no gravi onli mark,0
3947,no da he is stupid da alway send like thi don believ ani of those messag pandi is a mental,0
3948,oi when you gonna ring,0
3949,miss call alert these number call but left no messag,1
3950,i attend but noth is there,0
3951,ard like dat lor we juz meet in mrt station then dun haf to come out,0
3952,no dear i wa sleep p,0
3953,er mw im fill tuth is aight,0
3954,will be offic around pm now i am go hospit,0
3955,actual i m wait for week when they start put ad,0
3956,anyth lor if they all go then i go lor,0
3957,u free on sat rite u wan watch infern affair wif me n darren n mayb xy,0
3958,yo you around a friend of mine s lookin to pick up later tonight,0
3959,stupid auto correct on my phone,0
3960,doubl evict thi week spiral and michael and good riddanc to them,0
3961,the world suffer a lot not becaus of the violenc of bad peopl but becaus of the silenc of good peopl gud night,0
3962,ok that cool it just off either raglan rd or edward rd behind the cricket ground gimm ring when ur closebi see you tuesday,0
3963,buy one egg for me da pleas,0
3964,have you start in skye,0
3965,have you bookedth hut and also your time off how are you by the way,0
3966,and sever to you sir,0
3967,u realli pig leh sleep so much my dad wake me up at smth eat lunch today,0
3968,my love i hope your not do anyth drastic don t you dare sell your pc or your phone,0
3969,freemsg our record indic you may be entitl to pound for the accid you had to claim for free repli with ye to thi msg to opt out text stop,1
3970,life style garment account no pleas,0
3971,lol wtf random btw is that your lunch break,0
3972,sez how u de arab boy hope u r all good give my love evri love ya eshxxxxxxxxxxx,0
3973,the lay man just to let you know you are miss and thought off do have a great day and if you can send me bimbo and ugo s number ill appreci safe,0
3974,detroit the home of snow enjoy it,0
3975,show ur colour euro offer get an england flag lion tone on ur phone click on the follow servic messag for info,1
3976,aight i m chillin in a friend s room so text me when you re on the way,0
3977,is toshiba porteg m gd,0
3978,well welp is sort of a semiobscur internet thing,0
3979,text pass to to collect your polyphon rington normal gpr charg appli onli enjoy your tone,1
3980,accordingli i repeat just text the word ok on your mobil phone and send,1
3981,loosu go to hospit de dont let it careless,0
3982,how much for an eighth,0
3983,omg joanna is freak me out she s look thru all my friend to find photo of me and then she s ask about stuff on my myspac which i haven t even log on in like a year,0
3984,send ur birthdat with month and year i will tel u ur life partner s name and the method of calcul repli must,0
3985,juz now havent woke up so a bit blur blur can dad went out liao i cant cum now oso,0
3986,how about cloth jewelri and trip,0
3987,block breaker now come in delux format with new featur and great graphic from t mobil buy for just by repli get bbdelux and take the challeng,1
3988,aah a cuddl would be lush i d need lot of tea and soup befor ani kind of fumbl,0
3989,import inform orang user today is your lucki day find out whi log onto http www urawinn com there s a fantast surpris await you,1
3990,are you plan with your famili set in stone,0
3991,pl dont forget to studi,0
3992,you ll never believ thi but i have actual got off at taunton wow,0
3993,den onli weekday got special price haiz cant eat liao cut nail oso muz wait until i finish drivin wat lunch still muz eat wat,0
3994,she just broke down a list of reason whi nobodi s in town and i can t tell if she s be sarcast or just faggi,0
3995,lt decim gt m but it not a common car here so it better to buy from china or asia or if i find it less expens i ll holla,0
3996,the greatest test of courag on earth is to bear defeat without lose heart gn tc,0
3997,sorri im stil fuck after last nite went tobe at got up work at,0
3998,hey so what the plan thi sat,0
3999,beauti sleep can help ur pimpl too,0
4000,great hope you are use your connect from mode men also co you can never know whi old friend can lead you to today,0
4001,natalja f is invit you to be her friend repli ye or no see her www sm ac u nat stop send stop frnd to,1
4002,where to get those,0
4003,kind of just miss train co of asthma attack nxt one in half hr so drive in not sure where to park,0
4004,ball is move a lot will spin in last so veri difficult to bat,0
4005,haiyoh mayb your hamster wa jealou of million,0
4006,can you pleas send me my aunti s number,0
4007,i m glad you are follow your dream,0
4008,i ve reach home final,0
4009,urgent import inform for user today is your lucki day find out whi log onto http www urawinn com there is a fantast surpris await you,1
4010,wn u r hurt by d prsn who s close u do fight wit dem coz somtim di fight save a relat bt be quiet leav nothin in a relat gud eveb,0
4011,u can call now,0
4012,scienc tell that chocol will melt under the sunlight pleas don t walk under the sunlight bcoz i don t want to loss a sweet friend,0
4013,ye i come to nyc for audiit and am tri to reloc,0
4014,i pock you up there befor,0
4015,congrat that s great i want to tell you not to tell me your score co it might make me relax but it motiv me so thank for share,0
4016,i wud never mind if u dont miss me or if u dont need me but u wil realli hurt me wen u need me amp u dont tell me take care,0
4017,hey mr what the name of that bill brison book the one about languag and word,0
4018,okay good no problem and thanx,0
4019,for you inform ikea is spell with all cap that is not yell when you thought i had left you you were sit on the bed among the mess when i came in i said we were go after you got home from class pleas don t tri and bullshit me it make me want to listen to you less,0
4020,call me when u re done,0
4021,g w r,0
4022,you best watch what you say caus i get drunk as a motherfuck,0
4023,kit strip you have been bill p netcollex ltd po box ig oja,1
4024,pleas call immedi as there is an urgent messag wait for you,1
4025,thesmszon com let you send free anonym and mask messag im send thi messag from there do you see the potenti for abus,1
4026,erm woodland avenu somewher do you get the parish magazin hi telephon number will be in there,0
4027,are there ta job avail let me know pleas co i realli need to start work,0
4028,aiyar hard type u later free then tell me then i call n scold n tell u,0
4029,yup i m free,0
4030,good good billi mate all gone just been jog again did enjoy concert,0
